{
  "generatedFrom": {
    "cleanupLedger": "garden/manifests/cleanup-ledger.json",
    "runtimeActivationPlan": "garden/manifests/runtime-activation-plan.json",
    "runtimeActivationPreflight": "garden/manifests/runtime-activation-preflight.json",
    "runtimeLinks": "garden/manifests/runtime-links.json",
    "sourceTurnoffReadiness": "garden/manifests/source-turnoff-readiness.json",
    "type": "RUNTIME_ACTIVATION_APPROVAL_INPUTS"
  },
  "packets": [
    {
      "approvalBoundary": "Requires explicit user approval after reviewing target contents, collision policy, and preflight reasons.",
      "approvalState": "ALREADY_ACTIVE",
      "collisionPolicy": "BACKUP_THEN_LINK",
      "evidence": {
        "manifest": "garden/manifests/runtime-links.json",
        "preflightReport": "garden/manifests/runtime-activation-preflight.json",
        "status": "PLANNED",
        "type": "RUNTIME_ACTIVATION_APPROVAL_EVIDENCE"
      },
      "name": "agent-skill-children",
      "notes": "Ready for explicit approval to add missing intelligence skill children as symlinks while leaving external runtime skills and non-skill artifacts untouched.",
      "operationType": "ACTIVATE_RUNTIME_LINK",
      "planStatus": "WAITING_APPROVAL",
      "preflightReasons": [
        "Runtime target already links every source child to the canonical source."
      ],
      "preflightStatus": "ALREADY_ACTIVE",
      "primitiveTypes": [
        "SKILL"
      ],
      "requiresApproval": true,
      "riskLevel": "MEDIUM",
      "rollback": "Remove links created during activation and restore any backed-up runtime paths before rerunning preflight.",
      "runtimeLinkStrategy": "SYMLINK_CHILDREN",
      "sourceKind": "DIRECTORY",
      "sourcePath": "/Users/amichne/code/intelligence/skills",
      "stepPreviews": [
        {
          "commandPreview": "test -d /Users/amichne/code/intelligence/skills",
          "description": "Verify source directory exists",
          "type": "RUNTIME_ACTIVATION_APPROVAL_STEP"
        },
        {
          "commandPreview": "ls -la /Users/amichne/.agents/skills 2>/dev/null || true",
          "description": "Review target directory before linking children",
          "type": "RUNTIME_ACTIVATION_APPROVAL_STEP"
        },
        {
          "commandPreview": "mkdir -p /Users/amichne/.agents/skills",
          "description": "Prepare target directory after approval if needed",
          "type": "RUNTIME_ACTIVATION_APPROVAL_STEP"
        },
        {
          "commandPreview": "find /Users/amichne/code/intelligence/skills -mindepth 1 -maxdepth 1 -type d -exec sh -c 'test -f \"$1/SKILL.md\" && echo ln -s \"$1\" \"$2/$(basename \"$1\")\"' sh '{}' /Users/amichne/.agents/skills ';'",
          "description": "Link eligible primitive children only after approval",
          "type": "RUNTIME_ACTIVATION_APPROVAL_STEP"
        }
      ],
      "targetKind": "DIRECTORY",
      "targetPath": "/Users/amichne/.agents/skills",
      "type": "RUNTIME_ACTIVATION_APPROVAL_PACKET"
    },
    {
      "approvalBoundary": "Requires explicit user approval after reviewing target contents, collision policy, and preflight reasons.",
      "approvalState": "ALREADY_ACTIVE",
      "collisionPolicy": "BACKUP_THEN_LINK",
      "evidence": {
        "manifest": "garden/manifests/runtime-links.json",
        "preflightReport": "garden/manifests/runtime-activation-preflight.json",
        "status": "PLANNED",
        "type": "RUNTIME_ACTIVATION_APPROVAL_EVIDENCE"
      },
      "name": "claude-agent-children",
      "notes": "Future activation still requires explicit approval before linking agent profiles.",
      "operationType": "ACTIVATE_RUNTIME_LINK",
      "planStatus": "WAITING_APPROVAL",
      "preflightReasons": [
        "Runtime target already links every source child to the canonical source."
      ],
      "preflightStatus": "ALREADY_ACTIVE",
      "primitiveTypes": [
        "AGENT"
      ],
      "requiresApproval": true,
      "riskLevel": "MEDIUM",
      "rollback": "Remove links created during activation and restore any backed-up runtime paths before rerunning preflight.",
      "runtimeLinkStrategy": "SYMLINK_CHILDREN",
      "sourceKind": "DIRECTORY",
      "sourcePath": "/Users/amichne/code/intelligence/agents",
      "stepPreviews": [
        {
          "commandPreview": "test -d /Users/amichne/code/intelligence/agents",
          "description": "Verify source directory exists",
          "type": "RUNTIME_ACTIVATION_APPROVAL_STEP"
        },
        {
          "commandPreview": "ls -la /Users/amichne/.claude/agents 2>/dev/null || true",
          "description": "Review target directory before linking children",
          "type": "RUNTIME_ACTIVATION_APPROVAL_STEP"
        },
        {
          "commandPreview": "mkdir -p /Users/amichne/.claude/agents",
          "description": "Prepare target directory after approval if needed",
          "type": "RUNTIME_ACTIVATION_APPROVAL_STEP"
        },
        {
          "commandPreview": "find /Users/amichne/code/intelligence/agents -mindepth 1 -maxdepth 1 \\( -type d -o -name '*.agent.md' \\) ! -name AGENTS.md -exec sh -c 'echo ln -s \"$1\" \"$2/$(basename \"$1\")\"' sh '{}' /Users/amichne/.claude/agents ';'",
          "description": "Link eligible primitive children only after approval",
          "type": "RUNTIME_ACTIVATION_APPROVAL_STEP"
        }
      ],
      "targetKind": "DIRECTORY",
      "targetPath": "/Users/amichne/.claude/agents",
      "type": "RUNTIME_ACTIVATION_APPROVAL_PACKET"
    },
    {
      "approvalBoundary": "Requires explicit user approval after reviewing target contents, collision policy, and preflight reasons.",
      "approvalState": "ALREADY_ACTIVE",
      "collisionPolicy": "FAIL_IF_EXISTS",
      "evidence": {
        "manifest": "garden/manifests/runtime-links.json",
        "preflightReport": "garden/manifests/runtime-activation-preflight.json",
        "status": "PLANNED",
        "type": "RUNTIME_ACTIVATION_APPROVAL_EVIDENCE"
      },
      "name": "codex-hook-adapters",
      "notes": "The approval packet will create the target directory before linking provider adapter configs. Keep provider-neutral hook metadata in this repository.",
      "operationType": "ACTIVATE_RUNTIME_LINK",
      "planStatus": "WAITING_APPROVAL",
      "preflightReasons": [
        "Runtime target already links every source child to the canonical source."
      ],
      "preflightStatus": "ALREADY_ACTIVE",
      "primitiveTypes": [
        "HOOK"
      ],
      "requiresApproval": true,
      "riskLevel": "MEDIUM",
      "rollback": "Remove links created during activation and restore any backed-up runtime paths before rerunning preflight.",
      "runtimeLinkStrategy": "SYMLINK_CHILDREN",
      "sourceKind": "DIRECTORY",
      "sourcePath": "/Users/amichne/code/intelligence/hooks/codex",
      "stepPreviews": [
        {
          "commandPreview": "test -d /Users/amichne/code/intelligence/hooks/codex",
          "description": "Verify source directory exists",
          "type": "RUNTIME_ACTIVATION_APPROVAL_STEP"
        },
        {
          "commandPreview": "ls -la /Users/amichne/.codex/hooks 2>/dev/null || true",
          "description": "Review target directory before linking children",
          "type": "RUNTIME_ACTIVATION_APPROVAL_STEP"
        },
        {
          "commandPreview": "mkdir -p /Users/amichne/.codex/hooks",
          "description": "Prepare target directory after approval if needed",
          "type": "RUNTIME_ACTIVATION_APPROVAL_STEP"
        },
        {
          "commandPreview": "find /Users/amichne/code/intelligence/hooks/codex -mindepth 1 -maxdepth 1 -type f -name '*.hooks.json' -exec sh -c 'echo ln -s \"$1\" \"$2/$(basename \"$1\")\"' sh '{}' /Users/amichne/.codex/hooks ';'",
          "description": "Link eligible primitive children only after approval",
          "type": "RUNTIME_ACTIVATION_APPROVAL_STEP"
        }
      ],
      "targetKind": "DIRECTORY",
      "targetPath": "/Users/amichne/.codex/hooks",
      "type": "RUNTIME_ACTIVATION_APPROVAL_PACKET"
    },
    {
      "approvalBoundary": "Requires explicit user approval after reviewing target contents, collision policy, and preflight reasons.",
      "approvalState": "ALREADY_ACTIVE",
      "collisionPolicy": "BACKUP_THEN_LINK",
      "evidence": {
        "manifest": "garden/manifests/runtime-links.json",
        "preflightReport": "garden/manifests/runtime-activation-preflight.json",
        "status": "PLANNED",
        "type": "RUNTIME_ACTIVATION_APPROVAL_EVIDENCE"
      },
      "name": "codex-skill-children",
      "notes": "Ready for explicit approval to add missing canonical intelligence skill children into the Apollo-backed Codex skill home as symlinks; approval remains required because the target is ~/.codex/skills -> /Users/amichne/code/apollo/skills.",
      "operationType": "ACTIVATE_RUNTIME_LINK",
      "planStatus": "WAITING_APPROVAL",
      "preflightReasons": [
        "Runtime target already links every source child to the canonical source."
      ],
      "preflightStatus": "ALREADY_ACTIVE",
      "primitiveTypes": [
        "SKILL"
      ],
      "requiresApproval": true,
      "riskLevel": "MEDIUM",
      "rollback": "Remove links created during activation and restore any backed-up runtime paths before rerunning preflight.",
      "runtimeLinkStrategy": "SYMLINK_CHILDREN",
      "sourceKind": "DIRECTORY",
      "sourcePath": "/Users/amichne/code/intelligence/skills",
      "stepPreviews": [
        {
          "commandPreview": "test -d /Users/amichne/code/intelligence/skills",
          "description": "Verify source directory exists",
          "type": "RUNTIME_ACTIVATION_APPROVAL_STEP"
        },
        {
          "commandPreview": "ls -la /Users/amichne/.codex/skills 2>/dev/null || true",
          "description": "Review target directory before linking children",
          "type": "RUNTIME_ACTIVATION_APPROVAL_STEP"
        },
        {